"Sort Key","Type","Name","Version","Name Space Id","Description","Steward","Value Type","Minimum Cardinality","Maximum Cardinality","Minimum Value","Maximum Value","Minimum Characters","Maximum Characters","Unit of Measure Type","Specified Unit Id","Attribute Concept","Conceptual Domain"
"disp:Color_Display_Settings:1        ","Class","Color_Display_Settings","1.0.0.0","disp","The Color_Display_Settings class provides guidance to data users on how to display a multi-banded Array object on a color-capable display device.","img","","","","","","","","","","",""
"disp:Color_Display_Settings:2         disp:color_display_axis:1            ","Attribute","color_display_axis","n/a","disp","The color_display_axis attribute identifies, by name, the axis of an Array (or Array subclass) that is intended to be displayed in the color dimension of a display device. I.e., bands from this dimension will be loaded into the red, green, and blue bands of the display device. The value of this attribute must match the value of one, and only one, axis_name attribute in an Axis_Array class of the associated Array.","img","ASCII_Short_String_Collapsed","1","1","Unbounded","Unbounded","1","255","Units_of_None","none","TBD_classConcept","SHORT_STRING"
"disp:Color_Display_Settings:2         pds:comment:1                       ","Attribute","comment","n/a","pds","The comment attribute is a character string expressing one or more remarks or thoughts relevant to the object.","TBD_steward","ASCII_Short_String_Collapsed","0","1","Unbounded","Unbounded","1","255","Units_of_None","none","TBD_classConcept","TBD_dataConcept"
"disp:Color_Display_Settings:2         disp:red_channel_band:1              ","Attribute","red_channel_band","n/a","disp","The red_channel_band attribute identifies the number of the band, along the band axis, that should be loaded, by default, into the red channel of a display device. The first band along the band axis has band number 1.","img","ASCII_Integer","1","1","1","9223372036854775807","Unbounded","Unbounded","Units_of_None","none","TBD_classConcept","INTEGER"
"disp:Color_Display_Settings:2         disp:green_channel_band:1            ","Attribute","green_channel_band","n/a","disp","The green_channel_band attribute identifies the number of the band, along the band axis, that should be loaded, by default, into the green channel of a display device. The first band along the band axis has band number 1.","img","ASCII_Integer","1","1","1","9223372036854775807","Unbounded","Unbounded","Units_of_None","none","TBD_classConcept","INTEGER"
"disp:Color_Display_Settings:2         disp:blue_channel_band:1             ","Attribute","blue_channel_band","n/a","disp","The blue_channel_band attribute identifies the number of the band, along the band axis, that should be loaded, by default, into the blue channel of a display device. The first band along the band axis has band number 1.","img","ASCII_Integer","1","1","1","9223372036854775807","Unbounded","Unbounded","Units_of_None","none","TBD_classConcept","INTEGER"
"disp:Display_Direction:1             ","Class","Display_Direction","1.0.0.0","disp","The Display_Direction class specifies which two of the dimensions of an Array object should be displayed and how they should be displayed in the vertical (line) and horizontal (sample) dimensions of a display device. This class is a modification of the corresponding class in the Display Dictionary, and is redefined here for convenience. The local_identifier_reference is used to identify the array or arrays to which this iteration of the class applies. Multiple entries are permitted the settings in the iteration of Display_Direction apply to all of the referenced arrays. ","img","","","","","","","","","","",""
"disp:Display_Direction:2              pds:local_identifier:1              ","Attribute","local_identifier","n/a","pds","The local_identifier attribute provides a character string which uniquely identifies the containing object within the label.","TBD_steward","ASCII_Local_Identifier","0","1","Unbounded","Unbounded","1","255","Units_of_None","none","TBD_classConcept","TBD_dataConcept"
"disp:Display_Direction:2              pds:local_identifier_reference:1    ","Attribute","local_identifier_reference","n/a","pds","The local_identifier_reference attribute provides the value of the local_identifier of the entity described by the referencing class. Note that a local_identifier attribute, with the same value as this local_identifier_reference, must be present within the label.","TBD_steward","ASCII_Local_Identifier_Reference","0","*","Unbounded","Unbounded","1","255","Units_of_None","none","TBD_classConcept","TBD_dataConcept"
"disp:Display_Direction:2              pds:comment:1                       ","Attribute","comment","n/a","pds","The comment attribute is a character string expressing one or more remarks or thoughts relevant to the object.","TBD_steward","ASCII_Short_String_Collapsed","0","1","Unbounded","Unbounded","1","255","Units_of_None","none","TBD_classConcept","TBD_dataConcept"
"disp:Display_Direction:2              disp:horizontal_display_axis:1       ","Attribute","horizontal_display_axis","n/a","disp","The horizontal_display_axis attribute identifies, by name, the axis of an Array (or Array subclass) that is intended to be displayed in the horizontal or ""sample"" dimension on a display device. The value of this attribute must match the value of one, and only one, axis_name attribute in an Axis_Array class of the associated Array.","img","ASCII_Short_String_Collapsed","1","1","Unbounded","Unbounded","1","255","Units_of_None","none","TBD_classConcept","SHORT_STRING"
"disp:Display_Direction:2              disp:horizontal_display_direction:1  ","Attribute","horizontal_display_direction","n/a","disp","The horizontal_display_direction attribute specifies the direction across the screen of a display device that data along the horizontal axis of an Array is supposed to be displayed.","img","ASCII_Short_String_Collapsed","1","1","Unbounded","Unbounded","13","13","Units_of_None","none","TBD_classConcept","SHORT_STRING"
"disp:Display_Direction:2              disp:horizontal_display_direction:2   Value:Left to Right","Value","Left to Right","","","The lowest indexed element along an array axis should be displayed at the left edge of a display device and elements with higher indices should be displayed further to the right. Note that this is the standard display direction for most major image formats."
"disp:Display_Direction:2              disp:horizontal_display_direction:2   Value:Right to Left","Value","Right to Left","","","The lowest indexed element along an array axis should be displayed at the right edge of a display device and elements with higher indices should be displayed further to the left. Note that virtually no image display formats use this display direction. Use this only when deliberately mirroring the image around the vertical axis."
"disp:Display_Direction:2              disp:vertical_display_axis:1         ","Attribute","vertical_display_axis","n/a","disp","The vertical_display_axis attribute identifies, by name, the axis of an Array (or Array subclass) that is intended to be displayed in the vertical or ""line"" dimension on a display device. The value of this attribute must match the value of one, and only one, axis_name attribute in an Axis_Array class of the associated Array.","img","ASCII_Short_String_Collapsed","1","1","Unbounded","Unbounded","1","255","Units_of_None","none","TBD_classConcept","SHORT_STRING"
"disp:Display_Direction:2              disp:vertical_display_direction:1    ","Attribute","vertical_display_direction","n/a","disp","The vertical_display_direction attribute specifies the direction along the screen of a display device that data along the vertical axis of an Array is supposed to be displayed.","img","ASCII_Short_String_Collapsed","1","1","Unbounded","Unbounded","13","13","Units_of_None","none","TBD_classConcept","SHORT_STRING"
"disp:Display_Direction:2              disp:vertical_display_direction:2     Value:Bottom to Top","Value","Bottom to Top","","","The lowest indexed element along an array axis should be displayed at the bottom edge of a display device and elements with higher indices should be displayed higher up. This is the display direction typically used for FITS formatted data."
"disp:Display_Direction:2              disp:vertical_display_direction:2     Value:Top to Bottom","Value","Top to Bottom","","","The lowest indexed element along an array axis should be displayed at the top edge of a display device and elements with higher indices should be displayed lower down. This is the display direction typically used for VICAR formatted data."
"disp:Display_Settings:1              ","Class","Display_Settings","1.0.0.0","disp","The Display_Settings class contains one or more classes describing how data should be displayed on a display device.","img","","","","","","","","","","",""
"disp:Movie_Display_Settings:1        ","Class","Movie_Display_Settings","1.0.0.0","disp","The Movie_Display_Settings class provides default values for the display of a multi-banded Array using a software application capable of displaying video content.","img","","","","","","","","","","",""
"disp:Movie_Display_Settings:2         disp:time_display_axis:1             ","Attribute","time_display_axis","n/a","disp","The time_display_axis attribute identifies, by name, the axis of an Array (or Array subclass), the bands of which are intended to be displayed sequentially in time on a display device. The frame_rate attribute, if present, provides the rate at which these bands are to be displayed.","img","ASCII_Short_String_Collapsed","1","1","Unbounded","Unbounded","1","255","Units_of_None","none","TBD_classConcept","SHORT_STRING"
"disp:Movie_Display_Settings:2         pds:comment:1                       ","Attribute","comment","n/a","pds","The comment attribute is a character string expressing one or more remarks or thoughts relevant to the object.","TBD_steward","ASCII_Short_String_Collapsed","0","1","Unbounded","Unbounded","1","255","Units_of_None","none","TBD_classConcept","TBD_dataConcept"
"disp:Movie_Display_Settings:2         disp:frame_rate:1                    ","Attribute","frame_rate","n/a","disp","The frame_rate attribute indicates the number of still pictures (or frames) that should be displayed per unit of time in a video. Note this is NOT necessarily the same as the rate at which the images were acquired.","img","ASCII_Real","0","1","1.0","1.7976931348623157e308","Unbounded","Unbounded","Units_of_Frame_Rate","none","TBD_classConcept","REAL"
"disp:Movie_Display_Settings:2         disp:loop_flag:1                     ","Attribute","loop_flag","n/a","disp","The loop_flag attribute specifies whether or not a movie object should be played repeatedly without prompting from the user.","img","ASCII_Boolean","0","1","Unbounded","Unbounded","Unbounded","Unbounded","Units_of_None","none","TBD_classConcept","BOOLEAN"
"disp:Movie_Display_Settings:2         disp:loop_flag:2                      Value:false","Value","false","","","The movie should be not be ""looped"" or played repeatedly."
"disp:Movie_Display_Settings:2         disp:loop_flag:2                      Value:true","Value","true","","","The movie should be ""looped"" or played repeatedly."
"disp:Movie_Display_Settings:2         disp:loop_count:1                    ","Attribute","loop_count","n/a","disp","The loop_count attribute specifies the number of times a movie should be ""looped"" or replayed before stopping.","img","ASCII_Integer","0","1","1","9223372036854775807","Unbounded","Unbounded","Units_of_None","none","TBD_classConcept","INTEGER"
"disp:Movie_Display_Settings:2         disp:loop_delay:1                    ","Attribute","loop_delay","n/a","disp","The loop_delay attribute specifies the amount of time to pause between ""loops"" or repeated playbacks of a movie.","img","ASCII_Real","0","1","0.0","1.7976931348623157e308","Unbounded","Unbounded","Units_of_Time","none","TBD_classConcept","REAL"
"disp:Movie_Display_Settings:2         disp:loop_back_and_forth_flag:1      ","Attribute","loop_back_and_forth_flag","n/a","disp","The loop_back_and_forth_flag attribute specifies whether or not a movie should only be ""looped"" or played repeatedly in the forward direction, or whether it should be played forward followed by played in reverse, iteratively.","img","ASCII_Boolean","0","1","Unbounded","Unbounded","Unbounded","Unbounded","Units_of_None","none","TBD_classConcept","BOOLEAN"
"disp:Movie_Display_Settings:2         disp:loop_back_and_forth_flag:2       Value:false","Value","false","","","When looping, the movie should only be played in the forward direction. This is the default behavior."
"disp:Movie_Display_Settings:2         disp:loop_back_and_forth_flag:2       Value:true","Value","true","","","When looping, the movie should be played in the forward direction, followed by the reverse direction, iteratively."
"geom:Articulation_Device_Parameters:1","Class","Articulation_Device_Parameters","1.0.0.0","geom","The Articulation_Device_Parameters class contains those attributes and sub-classes that describe an articulation device. An articulation device is anything that can move independently of the spacecraft to which it is attached. Examples include mast heads, wheel bogies, arms, filter wheel, scan platforms. ","geo","","","","","","","","","","",""
"geom:Articulation_Device_Parameters:2 pds:local_identifier:1              ","Attribute","local_identifier","n/a","pds","The local_identifier attribute provides a character string which uniquely identifies the containing object within the label.","TBD_steward","ASCII_Local_Identifier","0","*","Unbounded","Unbounded","1","255","Units_of_None","none","TBD_classConcept","TBD_dataConcept"
"geom:Articulation_Device_Parameters:2 geom:device_id:1                     ","Attribute","device_id","n/a","geom","The device_id attribute specifies the abbreviated identification of an articulation device. ","geo","ASCII_Short_String_Collapsed","0","1","Unbounded","Unbounded","1","255","Units_of_None","none","TBD_classConcept","SHORT_STRING"
"geom:Articulation_Device_Parameters:2 geom:device_name:1                   ","Attribute","device_name","n/a","geom","The device_name attribute specifies the common name of an articulation device. ","geo","ASCII_Short_String_Collapsed","1","1","Unbounded","Unbounded","1","255","Units_of_None","none","TBD_classConcept","SHORT_STRING"
"geom:Articulation_Device_Parameters:2 geom:device_mode:1                   ","Attribute","device_mode","n/a","geom","The device_mode attribute specifies the deployment state (i.e., physical configuration) of an articulation device at the time of data acquisition. Examples include 'Arm Vibe', 'Deployed', 'Free Space', 'Stowed'. Note: the value set for this attribute is mission-specific and should be declared in a mission-specific dictionary. ","geo","ASCII_Short_String_Collapsed","0","1","Unbounded","Unbounded","1","255","Units_of_None","none","TBD_classConcept","SHORT_STRING"
"geom:Articulation_Device_Parameters:2 geom:device_phase:1                  ","Attribute","device_phase","n/a","geom","The device_phase attribute specifies the current phase of the mission, from an articulation-device-centric point of view. ","geo","ASCII_Short_String_Collapsed","0","1","Unbounded","Unbounded","1","255","Units_of_None","none","TBD_classConcept","SHORT_STRING"
"geom:Articulation_Device_Parameters:2 geom:selected_instrument_id:1        ","Attribute","selected_instrument_id","n/a","geom","The selected_instrument_id attribute specifies an abbreviated name or acronym that identifies the selected instrument mounted on the articulation device. ","geo","ASCII_Short_String_Collapsed","0","1","Unbounded","Unbounded","1","255","Units_of_None","none","TBD_classConcept","SHORT_STRING"
"geom:Body_Identification_Base:1      ","Class","Body_Identification_Base","1.0.0.0","geom","The Body_Identification_Base class provides multiple attributes that can be used to identify a physical object (spacecraft, planet instrument, transmitter, system barycenter, etc.). At least one must be used. ","geo","","","","","","","","","","",""
"geom:Body_Identification_Base:2       pds:local_identifier:1              ","Attribute","local_identifier","n/a","pds","The local_identifier attribute provides a character string which uniquely identifies the containing object within the label.","TBD_steward","ASCII_Local_Identifier","0","1","Unbounded","Unbounded","1","255","Units_of_None","none","TBD_classConcept","TBD_dataConcept"
"geom:Body_Identification_Base:2       geom:body_spice_name:1               ","Attribute","body_spice_name","n/a","geom","The body_spice_name attribute is a NAIF-recognized string identifier for a physical object (spacecraft, planet, instrument transmitter, system barycenter, etc.), associated with the data. ","geo","ASCII_Short_String_Collapsed","0","1","Unbounded","Unbounded","1","255","Units_of_None","none","TBD_classConcept","SHORT_STRING"
"geom:Body_Identification_Base:2       pds:name:1                          ","Attribute","name","n/a","pds","The name attribute provides a word or combination of words by which the object is known.","TBD_steward","UTF8_Short_String_Collapsed","0","1","Unbounded","Unbounded","1","255","Units_of_None","none","TBD_classConcept","TBD_dataConcept"
"geom:CAHVORE_Model:1                 ","Class","CAHVORE_Model","1.0.0.0","geom","The CAHVORE model is built upon CAHVOR (see CAHVOR_Model), adding support for fisheye lenses. It adds one more 3-vector and two scalars to CAHVOR. E (Entrance_Terms) contains the coefficients of a polynomial function used to model movement of the entrance pupil. The two scalars, cahvore_model_type and cahvore_model_parameter, together specify the type of lens being modeled. ","geo","","","","","","","","","","",""
"geom:CAHVORE_Model:2                  geom:cahvore_model_type:1            ","Attribute","cahvore_model_type","n/a","geom","The cahvore_model_type attribute indicates which variant of the CAHVORE model to use. Type 1 is a perspective-projection model, similar to CAHV and CAHVOR except for the moving entrance pupil. Type 2 is a fish-eye lens model reflecting fundamentally different geometry. Type 3 is a generalization that includes the first two, and is used for most fisheye-type lenses (see cahvore_model_parameter). ","geo","ASCII_Integer","0","1","-9223372036854775808","9223372036854775807","Unbounded","Unbounded","Units_of_None","none","TBD_classConcept","INTEGER"
"geom:CAHVORE_Model:2                  geom:cahvore_model_type:2             Value:1","Value","1","","","A perspective-projection model, similar to CAHV and CAHVOR except for the moving entrance pupil"
"geom:CAHVORE_Model:2                  geom:cahvore_model_type:2             Value:2","Value","2","","","A fish-eye lens model reflecting fundamentally different geometry"
"geom:CAHVORE_Model:2                  geom:cahvore_model_type:2             Value:3","Value","3","","","A generalization that includes the first two, and is used for most fisheye-type lenses"
"geom:CAHVORE_Model:2                  geom:cahvore_model_parameter:1       ","Attribute","cahvore_model_parameter","n/a","geom","The cahvore_parameter_type attribute is a scalar floating-point number used for CAHVORE Type 3 models (see cahvore_model_type). If the parameter is 1.0, the model is identical to type 1; if 0.0, it is identical to type 2. Most fish-eye lenses use a value in between. ","geo","ASCII_Real","0","1","-1.7976931348623157e308","1.7976931348623157e308","Unbounded","Unbounded","Units_of_None","none","TBD_classConcept","REAL"
"geom:CAHVOR_Model:1                  ","Class","CAHVOR_Model","1.0.0.0","geom","The CAHVOR model is built upon CAHV (see CAHV_Model), adding radial (barrel or pincushion) distortion to the linear model. It adds two more 3-vectors to CAHV. O (Vector_Optical) is a unit vector representing the axis of symmetry for the radial distortion. R (Radial_Terms) contains the coefficients of a polynomial function that describes the radial distortion. ","geo","","","","","","","","","","",""
"geom:CAHV_Model:1                    ","Class","CAHV_Model","1.0.0.0","geom","The CAHV model is a linear, perspective-projection camera model (equivalent to a pinhole camera). It consists of four 3-vectors (C,A,H,V) that describe the internal and external camera model parameters needed to translate between 2D image coordinates and 3D world coordinates. C (Vector_Center) is the 3D position of the pinhole (center of the entrance pupil). A (Vector_Axis) is a unit vector normal to the image plane pointing outward. H (Vector_Horizontal) is a composite vector encoding three quantities: H' (a vector in the image plane perpendicular to the vertical columns), Hs (the distance between the lens center and image plane, measured in horizontal pixels), and Hc (the horizontal image coordinate directly under C when moving parallel to A). V (Vector_Vertical) similarly composites the analogous V', Vs, and Vc in the vertical direction. ","geo","","","","","","","","","","",""
"geom:Camera_Model_Parameters:1       ","Class","Camera_Model_Parameters","1.0.0.0","geom","A camera model describes the mathematical relationship between the coordinates of a point in 3-dimensional space and its projection onto a 2-dimensional image plane. There are numerous types of camera models. ","geo","","","","","","","","","","",""
"geom:Camera_Model_Parameters:2        geom:model_type:1                    ","Attribute","model_type","n/a","geom","The model_type attribute specifies an identifier for the type or kind of model. The value should be one of a well defined set, providing an application program with sufficient information to know how to handle the rest of the parameters within the model. This value will correlate directly with the specific camera model class that is a subclass of the Camera_Model_Parameters class. ","geo","ASCII_Short_String_Collapsed","1","1","Unbounded","Unbounded","1","255","Units_of_None","none","TBD_classConcept","SHORT_STRING"
"geom:Camera_Model_Parameters:2        geom:model_type:2                     Value:CAHV","Value","CAHV","","","The CAHV model is a linear, perspective-projection camera model (equivalent to a pinhole camera)."
"geom:Camera_Model_Parameters:2        geom:model_type:2                     Value:CAHVOR","Value","CAHVOR","","","The CAHVOR model is built upon CAHV (see CAHV_Model), adding radial (barrel or pincushion) distortion to the linear model."
"geom:Camera_Model_Parameters:2        geom:model_type:2                     Value:CAHVORE","Value","CAHVORE","","","The CAHVORE model is built upon CAHVOR (see CAHVOR_Model), adding support for fisheye lenses."
"geom:Camera_Model_Parameters:2        geom:model_type:2                     Value:PSPH","Value","PSPH","","","The PSPH model is designed to perform better fisheye-image rectification prior to 1D stereo correlation."
"geom:Camera_Model_Parameters:2        geom:calibration_source_id:1         ","Attribute","calibration_source_id","n/a","geom","The calibration_source_id is used to identify the source used in calibrating the instrument. ","geo","ASCII_Short_String_Collapsed","0","1","Unbounded","Unbounded","1","255","Units_of_None","none","TBD_classConcept","SHORT_STRING"
"geom:Camera_Model_Parameters:2        geom:solution_id:1                   ","Attribute","solution_id","n/a","geom","The solution_id attribute specifies the unique identifier for the solution set to which the values in the group belong. For certain kinds of information, such as pointing correction (pointing models) and rover localization (coordinate system definitions), the ""true"" value is unknown and only estimates of the true value exist. Thus, more than one set of estimates may exist simultaneously, each valid for its intended purpose. Each of these sets is called a ""solution"" to the unknown true value. The solution_id attribute is used to identify which solution is being expressed by the containing group. No specific naming convention is defined here, however it is recommended that projects adopt one. The intent is to be able to identify who created the solution, and why. Possible components of the naming convention include user, institution, purpose, request ID, version, program, date/time. ","geo","ASCII_Short_String_Collapsed","0","1","Unbounded","Unbounded","1","255","Units_of_None","none","TBD_classConcept","SHORT_STRING"
"geom:Central_Body_Identification:1   ","Class","Central_Body_Identification","1.0.0.0","geom","The Central_Body_Identification class uniquely identifies the body that is the central body associated with an observation (e.g., Saturn for Saturn system observations). ","geo","","","","","","","","","","",""
"geom:Central_Body_Identification:2    pds:local_identifier:1              ","Attribute","local_identifier","n/a","pds","The local_identifier attribute provides a character string which uniquely identifies the containing object within the label.","TBD_steward","ASCII_Local_Identifier","0","1","Unbounded","Unbounded","1","255","Units_of_None","none","TBD_classConcept","TBD_dataConcept"
"geom:Central_Body_Identification:2    geom:body_spice_name:1               ","Attribute","body_spice_name","n/a","geom","The body_spice_name attribute is a NAIF-recognized string identifier for a physical object (spacecraft, planet, instrument transmitter, system barycenter, etc.), associated with the data. ","geo","ASCII_Short_String_Collapsed","0","1","Unbounded","Unbounded","1","255","Units_of_None","none","TBD_classConcept","SHORT_STRING"
